{
  "$schema": "http://json-schema.org/draft-04/schema#",
  "type": "object",
  "properties": {
    "source": {
      "type": "string"
    },
    "casetype": {
      "type": "string"
    },
    "firstName": {
      "type": "string"
    },
    "lastName": {
      "type": "string"
    },
    "phone": {
      "type": "string"
    },
    "email": {
      "type": "string"
    },
    "dateOfBirth": {
      "type": "string"
    },
    "nationalID": {
      "type": "string"
    },
    "nationalIDType": {
      "type": "string"
    },
    "address": {
      "type": "object",
      "properties": {
        "street": {
          "type": "string"
        },
        "city": {
          "type": "string"
        },
        "state": {
          "type": "string"
        },
        "postal": {
          "type": "string"
        },
        "country": {
          "type": "string"
        }
      },
      "required": [
        "street",
        "city",
        "state",
        "postal",
        "country"
      ]
    }
  },
  "required": [
    "source",
    "casetype",
    "firstName",
    "lastName",
    "phone",
    "dateOfBirth",
    "nationalID",
    "nationalIDType",
    "address"
  ]
}